# name: test/sql/insert/test_insert_type.test
# description: Test insert into from wrong type
# group: [insert]

statement ok
CREATE TABLE strings(a VARCHAR)

statement ok
CREATE TABLE integers(i INTEGER)

statement ok
INSERT INTO integers VALUES (3), (4), (NULL)

statement ok
INSERT INTO strings SELECT i FROM integers

query T
SELECT a FROM strings order by a
----
NULL
3
4


statement ok
UPDATE strings SET a=13 WHERE a=3

query T
SELECT * FROM strings ORDER BY cast(a AS INTEGER)
----
NULL
4
13

